54) Davant d'un frau on acaben suplantant la teva identitat; has d'exercir els drets ARCO. Què signifiquen les sigles? Què hauries de fer?, a) Accés; Rectificació; Comprovació i Oposició., b) Accés; Rectificació; Cancel·lació i Oposició., c) Afirmació; Rectificació; Comprovació i Oposició, b) Accés; Rectificació; Cancel·lació i Oposició., Resposta: Els drets ARCO fan referència al dret d'accés; rectificació; cancel·lació i oposició que tenim en relació amb l'ús que es fa de les nostres dades.
55) Reps un SMS de la teva companyia de telèfon informant-te d'un error a la teva última factura. Et demanen que facis clic en un enllaç; però en entrar i descarregar l’arxiu; es tractava d’un malware. Com es coneix aquest frau?, a) Grooming., b) Baitering., c) Smishing., c) Smishing., Resposta: Aquest tipus de ciberatac es coneix com smishing; utilitzen els SMS per enganyar-nos i fer que ens descarreguem malware o que fem clic a webs malicioses.
56) Quins factors t'haurien de fer desconfiar en tractar amb un venedor d'una web de compravenda en línia?, a) Volen utilitzar la plataforma de pagament de la web., b) Volen seguir la comunicació per WhatsApp., c) Té diversos mesos d'antiguitat a la web amb moltes valoracions., b) Volen seguir la comunicació per WhatsApp., Resposta: Si un venedor intenta utilitzar un altre canal de comunicació o forma de pagament diferent del de la web; podria ser un frau; és una pràctica molt habitual utilitzada entre els ciberdelinqüents.
57) Acaba d'arribar-te una oferta de feina molt interessant. No obstant; alguna cosa et fa mala olor. Quina de les opcions següents seria un indici de frau?, a) Demana contactar amb un número de tarifació especial., b) Demana doblers com a despeses d'administració per avançat., c) Ambdues opcions., c) Ambdues opcions., Resposta: Aquelles ofertes de feina que demanen trucar a un telèfon de tarifació especial o sol·liciten uns doblers per avançat són candidates a tractar-se d'un frau.
58) Heu rebut una trucada d'un suposat suport tècnic. Després de seguir els passos indicats; t'adones que s'ha pogut tractar d'un frau. Què hauries de fer?, a) Canviar les contrasenyes de tots els comptes., b) Desinstal·lar les apps que hagin instal·lat al teu equip., c) Ambdues opcions són correctes., Resposta: Si creiem que és víctima d'un possible frau d'aquest tipus; el més important és deshabilitar qualsevol canvi a la nostra configuració; desinstal·lar qualsevol app i canviar les contrasenyes dels nostres equips. Una anàlisi amb el nostre antivirus també seria recomanable.
59) És hora de canviar de casa i estàs mirant lloguers per la teva zona. Quina de les opcions següents no us ajudarà a evitar fraus?, a) Comprovar les adreces a Google Maps ., b) Revisar les descripcions i imatges a la recerca de fallides o dobles., c) Desconfiar de les agències., c) Desconfiar de les agències., Resposta: La clau per detectar possibles fraus als lloguers és revisar detingudament les descripcions i imatges. A més; convé utilitzar Google Maps i Google Imatges per comprovar que l'adreça i les fotografies utilitzades són reals.
60) Acabes de rebre un correu de la teva Marketplace preferida on t'avisen d'una promoció per la qual et regalen 50€. Només heu d'accedir a l'enllaç per obtenir el codi. Què has de fer?, a) Accedir a l'enllaç i reclamar-ne el codi., b) Passar el cursor sobre l’enllaç per veure si dirigeix a la web original., c) Copiar l'enllaç i accedir-hi des de manera incògnita., b) Passar el cursor sobre l’enllaç per veure si dirigeix a la web original., Resposta: Per evitar acabar sent víctima d'un frau; recorda passar el cursor per sobre per veure la web real a què et redirigeix.